{"type":"config","name":"Speed up tmux-sessionx popup render latency","metricName":"popup_launch_ms","metricUnit":"ms","bestDirection":"lower"}
{"run":1,"commit":"b16127d","metric":460.423,"metrics":{},"status":"keep","description":"Establish baseline popup benchmark and functional checks using a real tmux popup-launch benchmark plus mocked scenario regression checks.","timestamp":1773664424412,"segment":0}
{"run":2,"commit":"550ace4","metric":379.15,"metrics":{},"status":"keep","description":"Avoid repeated session list work before launching the popup by skipping custom-path session scans when no custom paths are configured, reusing the same sorted session list across input builders, and removing the duplicate additional_input call in handle_input.","timestamp":1773664477594,"segment":0}
{"run":3,"commit":"09e671f","metric":211.138,"metrics":{},"status":"keep","description":"Bundle popup-launch runtime settings into one cached tmux option built by sessionx.tmux, then hydrate those values with a single tmux call in scripts/sessionx.sh instead of many per-popup tmux show-option lookups.","timestamp":1773664590015,"segment":0}
{"run":4,"commit":"d6071ca","metric":179.777,"metrics":{},"status":"keep","description":"Collapse popup-launch state hydration to a single tmux show-option call by caching args, fzf options, and runtime settings together in one built state payload.","timestamp":1773664653004,"segment":0}
{"run":5,"commit":"d6071ca","metric":190.388,"metrics":{},"status":"discard","description":"Tried simplifying get_sorted_sessions with tmux's session-name format and direct printing instead of sed/awk post-processing, but popup launch got slower on the benchmark.","timestamp":1773664735704,"segment":0}
{"run":6,"commit":"d6071ca","metric":191.598,"metrics":{},"status":"discard","description":"Tried lazy-loading tmuxinator, fzf-marks, and git-branch helpers only in handle_output, but popup launch regressed slightly on the real benchmark.","timestamp":1773664833385,"segment":0}
{"run":7,"commit":"d6071ca","metric":175.887,"metrics":{},"status":"discard","description":"Verification benchmark on the current best code while running inside tmux. Result is slightly faster than the previous best but there were no code changes, so treat it as measurement variance rather than a new improvement.","timestamp":1773665396158,"segment":0}
{"run":8,"commit":"d6071ca","metric":202.41,"metrics":{},"status":"discard","description":"Tried replacing get_sorted_sessions and current-session filtering with pure Bash loops to remove sed/grep/awk from the hot path, but the real popup-launch benchmark regressed.","timestamp":1774002882583,"segment":0,"confidence":17.897771116992434}
{"run":9,"commit":"d6071ca","metric":186.943,"metrics":{},"status":"discard","description":"Tried replacing the pre-fzf echo/sed/tail pipeline with printf, Bash string substitution, and in-shell last-line extraction to cut process startup, but the popup-launch benchmark regressed.","timestamp":1774002972627,"segment":0,"confidence":23.74130784197609}
{"run":10,"commit":"70c1b5e","metric":167.272,"metrics":{},"status":"keep","description":"Combine current-session and last-session lookup into one tmux display-message call per popup launch, cache those values in the shell runtime, and update the profiler harness to mirror the combined format.","timestamp":1774003030413,"segment":0,"confidence":22.10541793914716}
{"run":11,"commit":"70c1b5e","metric":185.685,"metrics":{},"status":"discard","description":"Tried switching the session list call to tmux's session-name format to avoid the sed strip step, but popup launch got slower than the current best.","timestamp":1774003078996,"segment":0,"confidence":24.384545000831828}
{"run":12,"commit":"70c1b5e","metric":184.727,"metrics":{},"status":"discard","description":"Tried removing dead helper functions from scripts/sessionx.sh to shrink parse overhead on launch, but the real popup benchmark regressed versus the current best.","timestamp":1774003131821,"segment":0,"confidence":27.059676004984503}
{"run":13,"commit":"7286ca1","metric":115.789,"metrics":{},"status":"keep","description":"Replace the generic fzf-tmux popup wrapper on the non-builtin popup path with a lean SessionX-specific tmux popup helper that preserves behavior and falls back to fzf-tmux if direct popup execution cannot safely complete.","timestamp":1774003686744,"segment":0,"confidence":31.17167149059331}
{"run":14,"commit":"7286ca1","metric":126.023,"metrics":{},"status":"discard","description":"Tried deferring tmuxinator, fzf-marks, and git-branch helper sourcing until after popup selection, but the isolated popup-launch benchmark regressed versus the new direct-popup helper baseline.","timestamp":1774003735847,"segment":0,"confidence":25.9875579685556}
{"run":15,"commit":"7286ca1","metric":121.306,"metrics":{},"status":"discard","description":"Tried inlining the direct-popup helper command to avoid writing a temporary popup script file, but the follow-up benchmark with more samples showed the small apparent gain was just noise and the median regressed.","timestamp":1774003803019,"segment":0,"confidence":20.60591928251122}
{"run":16,"commit":"7286ca1","metric":120.388,"metrics":{},"status":"discard","description":"Tried folding current-session filtering into get_sorted_sessions to remove the extra hot-path grep, but the isolated popup benchmark regressed relative to the direct-popup helper baseline.","timestamp":1774003919163,"segment":0,"confidence":19.616028231544195}
{"run":17,"commit":"7286ca1","metric":130.734,"metrics":{},"status":"discard","description":"Tried a carefully gated builtin fzf --tmux fast path with fallback to the current direct-popup helper and fzf-tmux, and updated the isolated benchmark harness to simulate builtin popup launches. Larger-sample validation showed the path regressed relative to the current best.","timestamp":1774004127135,"segment":0,"confidence":19.4895662500707}
{"run":18,"commit":"7286ca1","metric":126.197,"metrics":{},"status":"discard","description":"Tried replacing the per-launch temporary popup script with a static repo runner script plus environment variables, but the direct-popup benchmark regressed relative to the current best.","timestamp":1774004222970,"segment":0,"confidence":14.054073892830933}
{"run":19,"commit":"7286ca1","metric":122.048,"metrics":{},"status":"discard","description":"Tried removing the now-redundant awk de-dup step in get_sorted_sessions after last-session exclusion, but the direct-popup benchmark regressed versus the current best.","timestamp":1774004287878,"segment":0,"confidence":10.989254169191028}
{"run":20,"commit":"7286ca1","metric":123.78,"metrics":{},"status":"discard","description":"Tried moving popup sizing out of the cached fzf args so the direct-popup helper no longer had to strip size flags on launch, but the benchmark regressed relative to the current best.","timestamp":1774004370001,"segment":0,"confidence":8.572558579175166}
{"run":21,"commit":"7286ca1","metric":117.55,"metrics":{},"status":"discard","description":"Tried a streaming popup helper that spools stdin to a file in the background and feeds the popup via tail -f so popup launch can overlap input capture while preserving fzf-tmux fallback. Larger-sample validation showed it was still slightly slower than the current best.","timestamp":1774004546325,"segment":0,"confidence":7.63258255265431}
{"run":22,"commit":"7286ca1","metric":118.274,"metrics":{},"status":"discard","description":"Tried removing the helper's extra status file by relying on tmux popup -E to propagate the popup command exit code and using output-file existence to detect successful popup execution, but larger-sample validation still regressed slightly versus the current best.","timestamp":1774004702700,"segment":0,"confidence":7.993551978475671}
{"run":23,"commit":"7286ca1","metric":125.23,"metrics":{},"status":"discard","description":"Tried caching a helper-specific fzf argument array with popup sizing already stripped so the direct-popup helper could skip argument reparsing on each launch, but the benchmark regressed versus the current best.","timestamp":1774004776780,"segment":0,"confidence":8.354966180998328}
{"run":24,"commit":"a66ce38","metric":110.526,"metrics":{},"status":"keep","description":"Inline the direct popup helper into scripts/sessionx.sh as a shell function so the non-builtin popup path avoids spawning a separate helper script process before invoking tmux popup, while preserving the same fallback behavior.","timestamp":1774004921475,"segment":0,"confidence":11.24582576695004}
{"run":25,"commit":"a66ce38","metric":118.194,"metrics":{},"status":"discard","description":"Tried replacing the hot-path sed character substitution with Bash string substitution while keeping the rest of the launch pipeline unchanged, but the popup benchmark regressed versus the current best.","timestamp":1774004968558,"segment":0,"confidence":17.314776326207433}
